channel_id,video_id,comment_id,date,author,comment_text
UCAa7V7ZM0_hhszN_GYEl0Sg,_C0cG-5lhdE,UgwTGBrgLIf26TxnU-h4AaABAg.9PmwVAxlgNv9PyhmvkTxUf,2021-07-19T09:07:46Z,Heidi A,"@Gunny Austria absolut richtig !! Und der Gesundheitsminister Frankenstein zieht schon wieder an, nächster LockDown in Kürze!! Flutkatastrophe geplant und erfolgreich ausgeführt !! Alle zwangsimpfen und einsperrn! Geplante Klimakatastrophe im Anmarsch! Es geht vorwärts!! Zur Belohnung steht der Basti auf 35% Zustimmung im Volk.....OE24"
UCAa7V7ZM0_hhszN_GYEl0Sg,_C0cG-5lhdE,UgwTGBrgLIf26TxnU-h4AaABAg.9PmwVAxlgNv9PphcWrRwhD,2021-07-15T21:13:11Z,Emma Aringer,"👍👍👍
Ja genau so ist...."
UCAa7V7ZM0_hhszN_GYEl0Sg,_C0cG-5lhdE,UgwTGBrgLIf26TxnU-h4AaABAg.9PmwVAxlgNv9PphZ0_wKo9,2021-07-15T21:12:34Z,Emma Aringer,"@Don ewaldo 
Und....Du bist bei einer  Gehirnwäsche gewesen...😰"
UCAa7V7ZM0_hhszN_GYEl0Sg,_C0cG-5lhdE,Ugwiy9C5qGlVa_nmll54AaABAg.9PmvjaQPvi59RC4IyDKUkg,2021-08-18T19:34:01Z,Grisu_122,Endlich kein schlechte r Kommentar irgendwie sagen alle er lügt
UCAa7V7ZM0_hhszN_GYEl0Sg,_C0cG-5lhdE,UgxVYFfCr5DtU2vm0914AaABAg.9PmoXGkKO2z9QmZOeARPJ5,2021-08-08T12:26:11Z,ledsepp,he has a clear vision of corruption.
UCAa7V7ZM0_hhszN_GYEl0Sg,_C0cG-5lhdE,UgxVYFfCr5DtU2vm0914AaABAg.9PmoXGkKO2z9Pyh2gWfG6p,2021-07-19T09:01:19Z,Heidi A,"You don´t know what he do to our country, he destroy everything what generations of austrians have built up after the WWII  !! This is his clear vision!! So bad!!"
UCAa7V7ZM0_hhszN_GYEl0Sg,_C0cG-5lhdE,UgxVYFfCr5DtU2vm0914AaABAg.9PmoXGkKO2z9PpLA6kQhaB,2021-07-15T17:48:11Z,Pierre De L'amour,"Because he is lying and no one knows where all the money goes! 
He breakes federal law and hast gained so much power evennouf highcourt can't reach him. 
KURZ MUST GO"
UCAa7V7ZM0_hhszN_GYEl0Sg,_C0cG-5lhdE,Ugz0YKsYIo-vs1XWQ_F4AaABAg.9PmmZItLjWC9QmkQeBPaDf,2021-08-08T14:11:19Z,Heidi A,@ledsepp ....so true !!
UCAa7V7ZM0_hhszN_GYEl0Sg,_C0cG-5lhdE,Ugz0YKsYIo-vs1XWQ_F4AaABAg.9PmmZItLjWC9QmcYVVVrMF,2021-08-08T13:02:29Z,ledsepp,"@KM yes, but we are on our way to autocracy, the transition takes time, our so called 'chancellor' is young and patient, takes one step after the other, almost unrecognisable for most of our population (and also for his voters).
sure there was also corruption under social democrats, lots and lots of it. but they at least tried to hide it from us, while these impudent snots seem to be proud of it."
UCAa7V7ZM0_hhszN_GYEl0Sg,_C0cG-5lhdE,Ugz0YKsYIo-vs1XWQ_F4AaABAg.9PmmZItLjWC9QmaP_3ZBPa,2021-08-08T12:43:47Z,KM,"@ledsepp believe me.... You haven't turned to autocracy and also not into corrupted land.

Compared to most around definitely not

Also don't believe there was no corruption during social Democrats era =absolutely the same."
UCAa7V7ZM0_hhszN_GYEl0Sg,_C0cG-5lhdE,Ugz0YKsYIo-vs1XWQ_F4AaABAg.9PmmZItLjWC9Qma3f3OQAT,2021-08-08T12:40:48Z,ledsepp,"our government is competent in tranferring the country from demo- to autocracy, it has absolutely no substance, no vision of what is going on and how to handle the most urgent topics.
in terms of corruption they always point at countries such as hungary, in fact austria has turned into one of the most currupt countries during their regime."
UCAa7V7ZM0_hhszN_GYEl0Sg,_C0cG-5lhdE,Ugz0YKsYIo-vs1XWQ_F4AaABAg.9PmmZItLjWC9PyinjpBgQA,2021-07-19T09:16:37Z,KM,@Heidi A Slovakia
UCAa7V7ZM0_hhszN_GYEl0Sg,_C0cG-5lhdE,Ugx0Q-6huVhn-pVhyZV4AaABAg,2021-07-14T17:24:42Z,Nicolae Cristian,👏👏👏
UCAa7V7ZM0_hhszN_GYEl0Sg,_C0cG-5lhdE,Ugy4bdnGYnGs7Wi9PXV4AaABAg,2021-07-14T17:15:36Z,iS-mail,Hello!Hr.Bundeskanzler 👏👏👏❤❤❤👍👍👍
